{
  "schemaVersion": "1.0",
  "description": "Business lifecycle state model for controlled documents. PRD F-005 requires this to remain separate from the native SharePoint Approval Status, which is modelled separately under 'platformApprovalStatus'.",
  "fieldInternalName": "DmsLifecycleStatus",
  "currentEffectiveFieldInternalName": "DmsCurrentEffective",

  "platformApprovalStatus": {
    "description": "Native SharePoint content-approval state. Platform-owned, never authoritative for business decisions. PRD section 2.8 and F-005.",
    "values": ["Draft", "Pending", "Approved", "Rejected", "Scheduled"],
    "rule": "No business rule may read platformApprovalStatus as a substitute for DmsLifecycleStatus. Activation sets both, in the order defined by transition T-11."
  },

  "states": [
    { "key": "Requested",                "displayName": "Requested",                  "order": 10,  "isTerminal": false, "currentEffective": false, "readerVisible": false, "description": "A change request exists and has not yet been triaged.", "requirements": ["F-007"] },
    { "key": "Triaged",                  "displayName": "Triaged",                    "order": 20,  "isTerminal": false, "currentEffective": false, "readerVisible": false, "description": "Document Control accepted the request and assigned owner, type and template.", "requirements": ["F-007"] },
    { "key": "Authoring",                "displayName": "Authoring",                  "order": 30,  "isTerminal": false, "currentEffective": false, "readerVisible": false, "description": "A draft revision is being prepared. Minor versions only.", "requirements": ["F-003", "F-004"] },
    { "key": "InReview",                 "displayName": "In Review",                  "order": 40,  "isTerminal": false, "currentEffective": false, "readerVisible": false, "description": "A specific file version and ETag are under review or approval.", "requirements": ["F-008", "F-009"] },
    { "key": "Rework",                   "displayName": "Rework",                     "order": 50,  "isTerminal": false, "currentEffective": false, "readerVisible": false, "description": "A review or approval stage was rejected and returned with mandatory rationale.", "requirements": ["F-011"] },
    { "key": "ApprovedPendingEffective", "displayName": "Approved Pending Effective", "order": 60,  "isTerminal": false, "currentEffective": false, "readerVisible": false, "description": "Approved but not yet authorised for operational use. Does not replace the current effective revision.", "requirements": ["F-012"] },
    { "key": "Effective",                "displayName": "Effective",                  "order": 70,  "isTerminal": false, "currentEffective": true,  "readerVisible": true,  "description": "The single revision authorised for current operational use in its applicability context.", "requirements": ["F-012", "F-013"] },
    { "key": "Superseded",               "displayName": "Superseded",                 "order": 80,  "isTerminal": false, "currentEffective": false, "readerVisible": false, "description": "Replaced by a later effective revision. Retained and discoverable only through the authorised history view.", "requirements": ["F-014"] },
    { "key": "Withdrawn",                "displayName": "Withdrawn",                  "order": 90,  "isTerminal": false, "currentEffective": false, "readerVisible": false, "description": "Removed from operational use with no replacement, including emergency suspension.", "requirements": ["F-016"] },
    { "key": "Obsolete",                 "displayName": "Obsolete",                   "order": 100, "isTerminal": true,  "currentEffective": false, "readerVisible": false, "description": "Terminal state. Retained only under the approved retention class until disposition.", "requirements": ["F-020"] }
  ],

  "transitions": [
    { "id": "T-01", "from": "Requested", "to": "Triaged", "trigger": "TriageAccept", "allowedActors": ["DocumentController"], "preconditions": ["RequestRequiredFieldsComplete", "NoOpenDuplicateRequest"], "systemEffects": ["AssignDocumentId", "LinkOrCreateDocumentRegisterItem", "AssignOwnerAndTemplate"], "evidenceCreated": ["ChangeRequestDecision"], "requirements": ["F-002", "F-007"], "workflow": "WF-01", "idempotencyKey": "RequestId+TriageDecision" },
    { "id": "T-02", "from": "Requested", "to": "Withdrawn", "trigger": "TriageRejectOrCancel", "allowedActors": ["DocumentController", "Requester"], "preconditions": ["RejectionRationaleProvided"], "systemEffects": ["CloseChangeRequest"], "evidenceCreated": ["ChangeRequestDecision"], "requirements": ["F-007"], "workflow": "WF-01", "idempotencyKey": "RequestId+TriageDecision" },
    { "id": "T-03", "from": "Triaged", "to": "Authoring", "trigger": "BeginAuthoring", "allowedActors": ["DocumentController", "Author"], "preconditions": ["DocumentIdAssigned", "ContentTypeAndTemplateResolved", "OwnerIsActiveIdentity"], "systemEffects": ["CreateDraftFromTemplate", "SetMinorVersioning"], "evidenceCreated": [], "requirements": ["F-003", "F-004"], "workflow": "WF-02", "idempotencyKey": "DocumentId+BusinessRevision" },
    { "id": "T-04", "from": "Triaged", "to": "Withdrawn", "trigger": "CancelAfterTriage", "allowedActors": ["DocumentController"], "preconditions": ["RejectionRationaleProvided"], "systemEffects": ["CloseChangeRequest"], "evidenceCreated": ["ChangeRequestDecision"], "requirements": ["F-007"], "workflow": "WF-01", "idempotencyKey": "DocumentId+BusinessRevision" },
    { "id": "T-05", "from": "Authoring", "to": "InReview", "trigger": "SubmitForReview", "allowedActors": ["Author", "DocumentController"], "preconditions": ["MandatoryMetadataComplete", "ChangeSummaryProvided", "FileCheckedIn", "RoutingRuleResolves", "NotBlockedByOpenBlockingException"], "systemEffects": ["CaptureSubmittedVersion", "CaptureSubmittedETag", "GenerateApprovalCorrelationId", "CreateReviewTasks"], "evidenceCreated": ["ApprovalEvidence:Submitted"], "requirements": ["F-008", "F-009", "NFR-011"], "workflow": "WF-02", "idempotencyKey": "ApprovalCorrelationId" },
    { "id": "T-06", "from": "Authoring", "to": "Withdrawn", "trigger": "AbandonDraft", "allowedActors": ["DocumentController"], "preconditions": ["RejectionRationaleProvided"], "systemEffects": ["CancelOpenTasks"], "evidenceCreated": ["ApprovalEvidence:Cancelled"], "requirements": ["F-016"], "workflow": "WF-02", "idempotencyKey": "DocumentId+BusinessRevision" },
    { "id": "T-07", "from": "InReview", "to": "Rework", "trigger": "RejectWithRationale", "allowedActors": ["Reviewer", "Approver"], "preconditions": ["RejectionRationaleProvided"], "systemEffects": ["CancelRemainingStageTasks", "ReturnCommentsToAuthor", "PreserveCurrentEffectiveRevision"], "evidenceCreated": ["ApprovalEvidence:Rejected"], "requirements": ["F-011"], "workflow": "WF-02", "idempotencyKey": "ApprovalCorrelationId+Stage+Actor" },
    { "id": "T-08", "from": "InReview", "to": "ApprovedPendingEffective", "trigger": "FinalApproval", "allowedActors": ["Approver"], "preconditions": ["AllRequiredStagesApproved", "SubmittedETagStillMatches", "EffectiveDateIsSet", "RetentionClassMapped"], "systemEffects": ["SetPlatformApprovalStatusApproved", "RecordApprovedVersion"], "evidenceCreated": ["ApprovalEvidence:Approved"], "requirements": ["F-010", "F-012", "F-018", "NFR-011"], "workflow": "WF-02", "idempotencyKey": "ApprovalCorrelationId+Stage+Actor" },
    { "id": "T-09", "from": "InReview", "to": "Authoring", "trigger": "WithdrawSubmission", "allowedActors": ["Author", "DocumentController"], "preconditions": [], "systemEffects": ["CancelOpenTasks", "InvalidateApprovalCorrelationId"], "evidenceCreated": ["ApprovalEvidence:Cancelled"], "requirements": ["F-011"], "workflow": "WF-02", "idempotencyKey": "ApprovalCorrelationId" },
    { "id": "T-10", "from": "Rework", "to": "Authoring", "trigger": "ResumeAuthoring", "allowedActors": ["Author", "DocumentController"], "preconditions": [], "systemEffects": ["NewApprovalInstanceRequiredOnResubmit"], "evidenceCreated": [], "requirements": ["F-011"], "workflow": "WF-02", "idempotencyKey": "DocumentId+BusinessRevision" },
    { "id": "T-11", "from": "ApprovedPendingEffective", "to": "Effective", "trigger": "ScheduledActivation", "allowedActors": ["SystemAutomation", "DocumentController"], "preconditions": ["EffectiveDateReached", "ApprovedETagStillMatches", "MandatoryMetadataComplete", "ApprovalEvidenceComplete", "NoOpenBlockingException", "NoOtherEffectiveRevisionAfterSupersession"], "systemEffects": ["PublishMajorVersion", "SetCurrentEffectiveTrue", "UpdateDocumentRegister", "ApplyRetentionClass", "CreateAcknowledgementAssignments", "SendLinkBasedNotification"], "evidenceCreated": ["ApprovalEvidence:Activated"], "requirements": ["F-012", "F-013", "F-017", "F-018", "NFR-006"], "workflow": "WF-03", "idempotencyKey": "DocumentId+BusinessRevision+Activated" },
    { "id": "T-12", "from": "ApprovedPendingEffective", "to": "Rework", "trigger": "ApprovalInvalidatedByContentChange", "allowedActors": ["SystemAutomation"], "preconditions": ["ApprovedETagMismatch"], "systemEffects": ["InvalidateApproval", "RaiseException:VersionIntegrity", "PreserveCurrentEffectiveRevision"], "evidenceCreated": ["ApprovalEvidence:Invalidated", "Exception:VersionIntegrity"], "requirements": ["F-008", "F-022", "NFR-011"], "workflow": "WF-03", "idempotencyKey": "ApprovalCorrelationId+Invalidated" },
    { "id": "T-13", "from": "ApprovedPendingEffective", "to": "Withdrawn", "trigger": "CancelBeforeEffective", "allowedActors": ["DocumentController", "Approver"], "preconditions": ["RejectionRationaleProvided"], "systemEffects": ["CancelScheduledActivation", "PreserveCurrentEffectiveRevision"], "evidenceCreated": ["ApprovalEvidence:Cancelled"], "requirements": ["F-016"], "workflow": "WF-03", "idempotencyKey": "DocumentId+BusinessRevision" },